,Names,description,ProgrammingLanguage
0,world_timeApp,          Display the time of selected cities by calling an API        ,Dart
1,loginsystem,          A basic loginsystem which can be implemented anywhere        ,PHP
2,classicalTodo,          A classical todo website to store your todos.        ,PHP
3,chocoTea,          A Tea preference App        ,Dart
4,empSallary,          An employee salary app based on BLOC pattern        ,Dart
5,student_idcardUI,"          UI design of an student displaying name, email and achievement        ",Dart
6,quotesApp,          Displays the Quote and the Author        ,Dart
7,git-one,          While learning GIT        ,HTML
